{
  "$schema": "https://json-schema.org/draft/2020-12/schema",
  "title": "ReviewItem",
  "type": "object",
  "required": ["review_item_id", "workflow_run_id", "subject_type", "subject_id", "status"],
  "properties": {
    "review_item_id": { "type": "string" },
    "workflow_run_id": { "type": "string" },
    "subject_type": { "type": "string" },
    "subject_id": { "type": "string" },
    "proposed_action": { "type": "string" },
    "evidence_refs": {
      "type": "array",
      "items": { "type": "string" }
    },
    "status": {
      "type": "string",
      "enum": ["pending", "approved", "rejected", "needs_revision", "locked"]
    },
    "reviewer": { "type": "string" },
    "decision_reason": { "type": "string" }
  }
}
